"activities","Activities","කටයුතු"
"walking","Walking","ඇවිදීම"
"walking_2","I like walking","මම ඇවිදින්න කැමතියි"
"walking_3","I don't like walking","මම ඇවිදින්න කැමති නැහැ"
"walking_4","Do you want to walk together?","ඔබට එකට ගමන් කිරීමට අවශ්‍යද?"
"running","Running","ධාවනය"
"running_2","I like running.","මම දුවන්න කැමතියි."
"running_3","I don't like running.","මම දුවන්න කැමති නැහැ."
"running_4","Do you want to go running?","ඔබට දුවන්නට අවශ්‍යද?"
"talking","Talking","කතා කිරීම"
"talking_2","I like talking.","මම කතා කරන්න කැමතියි."
"talking_3","I don't like talking.","මම කතා කරන්න කැමති නැහැ."
"talking_4","Do you want to talk with me?","ඔබට මා සමඟ කතා කිරීමට අවශ්‍යද?"
"reading","Reading","කියවීම"
"reading_2","I like reading.","මම කියවන්න කැමතියි."
"reading_3","I don't like reading.","මම කියවීමට කැමති නැත."
"reading_4","Do you want to read together?","ඔබට එකට කියවීමට අවශ්‍යද?"
"football","Football","පාපන්දු"
"football_2","I like playing football.","මම පාපන්දු ක්‍රීඩා කිරීමට කැමතියි."
"football_3","I don't like playing football.","මම පාපන්දු ක්‍රීඩා කිරීමට කැමති නැහැ."
"football_4","Do you want to play football?","ඔබට පාපන්දු ක්‍රීඩා කිරීමට අවශ්‍යද?"
"basketball","Basketball","පැසිපන්දු"
"basketball_2","I like playing basketball.","මම පැසිපන්දු ක්‍රීඩා කිරීමට කැමතියි."
"basketball_3","I don't like playing basketball.","මම පැසිපන්දු ක්‍රීඩා කිරීමට කැමති නැත."
"basketball_4","Do you want to play basketball?","ඔබට පැසිපන්දු ක්‍රීඩා කිරීමට අවශ්‍යද?"
"swimming","Swimming","පිහිනීම"
"swimming_2","I like swimming.","පිහිනුමට මා කැමතිය."
"swimming_3","I don't like swimming.","මම පිහිනීමට කැමති නැහැ."
"swimming_4","Do you want to go to swimming?","ඔබට පිහිනීමට යාමට අවශ්‍යද?"
"painting","Painting","පින්තාරු කිරීම"
"painting_2","I like painting.","මම පින්තාරු කිරීමට කැමතියි."
"painting_3","I don't like painting.","මම පින්තාරු කිරීමට කැමති නැහැ."
"painting_4","Do you want to paint together?","ඔබට එකට තීන්ත ආලේප කිරීමට අවශ්‍යද?"
"drawing","Drawing","ඇඳීම"
"drawing_2","I like drawing.","මම කැමති චිත්ර අඳින්න."
"drawing_3","I don't like drawing.","මම චිත්‍ර ඇඳීමට කැමති නැත."
"drawing_4","Do you want to draw together?","ඔබට එකට ඇඳීමට අවශ්‍යද?"
"cycling","Cycling","පාපැදි පැදීම"
"cycling_2","I like cycling.","මම බයිසිකල් පැදීමට කැමතියි."
"cycling_3","I don't like cycling.","මම බයිසිකල් පැදීමට කැමති නැත."
"cycling_4","Do you want to go cycling?","ඔබට බයිසිකල් පැදීමට අවශ්‍යද?"
"skating","Skating","ස්කේටිං"
"skating_2","I like skating.","මම ලිස්සා යෑමට කැමතියි."
"skating_3","I don't like skating.","මම ලිස්සා යෑමට කැමති නැහැ."
"skating_4","Do you want to go skating?","ඔබට ස්කේටිං යන්න අවශ්‍යද?"
"sightseeing","Sightseeing","දර්ශන නැරඹීම"
"sightseeing_2","I like sightseeing.","මම දර්ශන නැරඹීමට කැමතියි."
"sightseeing_3","I don't like sightseeing.","මම දර්ශන නැරඹීමට කැමති නැහැ."
"sightseeing_4","Do you want to go for sightseeing?","ඔබට දර්ශන නැරඹීමට යාමට අවශ්‍යද?"
"video-games","Video games","වීඩියෝ ක්රීඩා"
"video-games_2","I like playing video games.","මම වීඩියෝ ක්‍රීඩා කිරීමට කැමතියි."
"video-games_3","I don't like playing video games.","මම වීඩියෝ ක්‍රීඩා කිරීමට කැමති නැත."
"video-games_4","Do you want to play games?","ඔබට ක්‍රීඩා කිරීමට අවශ්‍යද?"
"tidying","Tidying","පිළිවෙලට"
"tidying_2","I like tidying my room.","මම කැමතියි මගේ කාමරය පිළිවෙලට කරන්න."
"tidying_3","I don't like tidying my room.","මගේ කාමරය පිළිවෙලට තැබීමට මම කැමති නැත."
"tidying_4","Can you help me tidy my room?","මගේ කාමරය පිළිවෙලට කිරීමට මට උදව් කළ හැකිද?"
"toys","Toys","සෙල්ලම් බඩු"
"toys_2","I like toys.","මම සෙල්ලම් බඩු වලට කැමතියි."
"toys_3","I don't like toys.","මම සෙල්ලම් බඩු වලට කැමති නැහැ."
"toys_4","Do you want to play with my toys?","ඔබට මගේ සෙල්ලම් බඩු සමඟ සෙල්ලම් කිරීමට අවශ්‍යද?"
"puzzle","Puzzle","ප්‍රහේලිකාව"
"puzzle_2","I like solving puzzle.","මම ප්‍රහේලිකාව විසඳීමට කැමතියි."
"puzzle_3","I don't like solving puzzle.","ප්‍රහේලිකාව විසඳීමට මා කැමති නැත."
"puzzle_4","Do you want to solve puzzles with me?","මා සමඟ ප්‍රහේලිකා විසඳීමට ඔබට අවශ්‍යද?"
"comics","Comics","විකට"
"comics_2","I like reading comics.","මම කොමික් කියවීමට කැමතියි."
"comics_3","I don't like reading comics.","මම කොමික් කියවීමට කැමති නැත."
"comics_4","Do you want to read comics?","ඔබට විකට චිත්‍ර කියවීමට අවශ්‍යද?"
"chess","Chess","චෙස්"
"chess_2","I like playing chess.","මම චෙස් ක්‍රීඩා කිරීමට කැමතියි."
"chess_3","I don't like playing chess.","මම චෙස් ක්‍රීඩා කිරීමට කැමති නැහැ."
"chess_4","Do you want to play chess with me?","ඔබට මා සමඟ චෙස් ක්‍රීඩා කිරීමට අවශ්‍යද?"
"using-leeloo","Using Leeloo","ලීලූ භාවිතා කිරීම"
"using-leeloo_2","I like using leeloo.","මම ලීලෝ භාවිතා කිරීමට කැමතියි."
"using-leeloo_3","I don't like using leeloo.","මම ලීලෝ භාවිතා කිරීමට කැමති නැත."
"using-leeloo_4","Can you change card packs on leeloo?","ඔබට ලීලෝ මත කාඩ් ඇසුරුම් වෙනස් කළ හැකිද?"
"texting","Texting","ටෙක්ස්ටිං"
"texting_2","I like texting.","මම කෙටි පණිවිඩ යැවීමට කැමතියි."
"texting_3","I don't like texting.","මම කෙටි පණිවිඩ යැවීමට කැමති නැත."
"knitting","Knitting","ගෙතීම"
"knitting_2","I like knitting.","මම ගෙතීමට කැමතියි."
"knitting_3","I don't like knitting.","මම ගෙතීමට කැමති නැහැ."
"knitting_4","I want to learn how to knit.","මට ගැටගැසීමට ඉගෙන ගැනීමට අවශ්‍යයි."
"bowling","Bowling","පන්දු යැවීම"
"bowling_2","I like bowling.","මම පන්දු යැවීමට කැමතියි."
"bowling_3","I don't like bowling.","මම පන්දු යැවීමට කැමති නැහැ."
"bowling_4","Do you want to play bowling with me?","ඔබට මා සමඟ පන්දු යැවීමට අවශ්‍යද?"
"watching-tv","Watching TV","ටීවි එක බලමින්"
"watching-tv_2","I like watching tv.","මම ටීවී බැලීමට කැමතියි."
"watching-tv_3","I don't like watching tv.","මම රූපවාහිනිය නැරඹීමට කැමති නැත."
"watching-tv_4","Do you want to watch tv?","ඔබට රූපවාහිනිය නැරඹීමට අවශ්‍යද?"
"fishing","Fishing","මාඵ ඇල්ලීම"
"fishing_2","I like fishing.","මම මසුන් ඇල්ලීමට කැමතියි."
"fishing_3","I don't like fishing.","මාළු ඇල්ලීමට මා කැමති නැත."
"fishing_4","Do you want to go to fishing?","ඔබට මසුන් ඇල්ලීමට යාමට අවශ්‍යද?"
"exercising","Exercising","ව්‍යායාම කිරීම"
"exercising_2","I like exercising.","මම ව්‍යායාම කිරීමට කැමතියි."
"exercising_3","I don't like exercising.","මම ව්‍යායාම කිරීමට කැමති නැහැ."
"exercising_4","Do you want to exercise with me?","ඔබට මා සමඟ ව්‍යායාම කිරීමට අවශ්‍යද?"
"tennis","Tennis","ටෙනිස්"
"tennis_2","I like playing tennis.","මම ටෙනිස් ක්‍රීඩා කිරීමට කැමතියි."
"tennis_3","I don't like playing tennis.","මම ටෙනිස් ක්‍රීඩා කිරීමට කැමති නැහැ."
"tennis_4","Do you want to play tennis with me?","ඔබට මා සමඟ ටෙනිස් ක්‍රීඩා කිරීමට අවශ්‍යද?"
"animals","Animals","සතුන්"
"cat","Cat","පූසා"
"cat_2","I like cats.","මම පූසන්ට කැමතියි."
"cat_3","I saw a cat.","මම පූසෙක් දැක්කා."
"cat_4","What noise does a cat make?","බළලෙකු කරන ශබ්දය කුමක්ද?"
"cat_5","Can we get a cat as pet?","අපට සුරතල් සතෙකු ලෙස බළලෙකු ලබා ගත හැකිද?"
"dog","Dog","බල්ලා"
"dog_2","I like dog.","මම බල්ලට කැමතියි."
"dog_3","I saw a dog.","මම බල්ලෙක් දැක්කා."
"dog_4","What noise does a dog make?","බල්ලෙක් කරන ශබ්දය කුමක්ද?"
"dog_5","Can we get a dog as pet?","අපට බල්ලෙකු සුරතල් ලෙස ලබා ගත හැකිද?"
"fish","Fish","මාළු"
"fish_2","I like fish.","මම මාළු වලට කැමතියි."
"fish_3","I saw a fish.","මම මාළුවෙක් දැක්කා."
"fish_4","What noise does a fish make?","මාළුවෙකුගේ ශබ්දය කුමක්ද?"
"fish_5","Can we get a fish as pet?","අපට සුරතලෙකු ලෙස මාළුවෙකු ලබා ගත හැකිද?"
"rabbit","Rabbit","හාවා"
"rabbit_2","I like rabbits.","මම හාවන්ට කැමතියි."
"rabbit_3","I saw a rabbit.","මම හාවෙකු දුටුවෙමි."
"rabbit_4","What noise does a rabbit make?","හාවෙකුගේ ශබ්දය කුමක්ද?"
"rabbit_5","Can we get a rabbit as pet?","අපට හාවෙකු සුරතල් ලෙස ලබා ගත හැකිද?"
"butterfly","Butterfly","සමනලයා"
"butterfly_2","I like butterflies.","මම සමනලුන්ට කැමතියි."
"butterfly_3","I saw a butterfly.","මම සමනලයෙක් දැක්කා."
"butterfly_4","What noise does a butterfly make?","සමනලයකු කරන ශබ්දය කුමක්ද?"
"kangaroo","Kangaroo","කැන්ගරු"
"kangaroo_2","I like kangaroos.","මම කැන්ගරු වලට කැමතියි."
"kangaroo_3","I saw a kangaroo.","මම කැන්ගරු කෙනෙක් දැක්කා."
"kangaroo_4","What noise does a kangaroo make?","කැන්ගරු කෙනෙක් කරන ශබ්දය කුමක්ද?"
"turtle","Turtle","කැස්බෑවා"
"turtle_2","I like turtles.","මම ඉබ්බන්ට කැමතියි."
"turtle_3","I saw a turtle.","මම කැස්බෑවෙක් දැක්කා."
"turtle_4","What noise does a turtle make?","කැස්බෑවෙකුගේ ශබ්දය කුමක්ද?"
"giraffe","Giraffe","ජිරාෆ්"
"giraffe_2","I like giraffes.","මම ජිරාෆ් වලට කැමතියි."
"giraffe_3","I saw a giraffe.","මම ජිරාෆ් කෙනෙක් දැක්කා."
"giraffe_4","What noise does a giraffe make?","ජිරාෆ් කෙනෙක් කරන ශබ්දය කුමක්ද?"
"frog","Frog","ගෙම්බා"
"frog_2","I like frogs.","මම ගෙම්බන්ට කැමතියි."
"frog_3","I saw a frog.","මම ගෙම්බෙක් දැක්කා."
"frog_4","What noise does a frog make?","ගෙම්බෙක් කරන ශබ්දය කුමක්ද?"
"swan","Swan","හංසයා"
"swan_2","I like swans.","මම හංසයන්ට කැමතියි."
"swan_3","I saw a swan.","මම හංසයා දැක්කා."
"swan_4","What noise does a swan make?","හංසයා කරන ශබ්දය කුමක්ද?"
"spider","Spider","මකුළුවා"
"spider_2","I like spiders.","මම මකුළුවන්ට කැමතියි."
"spider_3","I saw a spider.","මම මකුළුවෙක් දැක්කා."
"spider_4","What noise does a spider make?","මකුළුවෙකුගේ ශබ්දය කුමක්ද?"
"cow","Cow","එළදෙන"
"cow_2","I like cows.","මම එළදෙනුන්ට කැමතියි."
"cow_3","I saw a cow.","මම එළදෙනක් දැක්කා."
"cow_4","What noise does a cow make?","එළදෙනෙක් කරන ශබ්දය කුමක්ද?"
"duck","Duck","තාරාවා"
"duck_2","I like ducks.","මම තාරාවන්ට කැමතියි."
"duck_3","I saw a duck.","මම තාරාවෙක් දැක්කා."
"duck_4","What noise does a duck make?","තාරාවෙක් කරන ශබ්දය කුමක්ද?"
"horse","Horse","අශ්වයා"
"horse_2","I like horses.","මම අශ්වයන්ට කැමතියි."
"horse_3","I saw a horse.","මම අශ්වයෙක් දැක්කා."
"horse_4","What noise does a horse make?","අශ්වයෙකු කරන ශබ්දය කුමක්ද?"
"chicken","Chicken","කුකුල් මස්"
"chicken_2","I like chickens.","මම කුකුළන්ට කැමතියි."
"chicken_3","I saw a chicken.","මම කුකුළෙක් දැක්කා."
"chicken_4","What noise does a chicken make?","කුකුළෙක් කරන ශබ්දය කුමක්ද?"
"bee","Bee","මී මැසි"
"bee_2","I like bees.","මම මී මැස්සන්ට කැමතියි."
"bee_3","I saw a bee.","මම මී මැස්සෙක් දැක්කා."
"bee_4","What noise does a bee make?","මී මැස්සෙක් කරන ශබ්දය කුමක්ද?"
"pig","Pig",".රු"
"pig_2","I like pigs.","මම igs රන්ට කැමතියි."
"pig_3","I saw a pig.","මම a රෙක් දැක්කා."
"pig_4","What noise does a pig make?","Pig රෙක් කරන ශබ්දය කුමක්ද?"
"dove","Dove","ඩව්"
"dove_2","I like doves.","මම පරෙවියන්ට කැමතියි."
"dove_3","I saw a dove.","මම පරෙවියෙකු දුටුවෙමි."
"dove_4","What noise does a dove make?","පරෙවියෙකු කරන ශබ්දය කුමක්ද?"
"crab","Crab","කකුළුවා"
"crab_2","I like crabs.","මම කකුළුවන්ට කැමතියි."
"crab_3","I saw a crab.","මම කකුළුවෙක් දැක්කා."
"crab_4","What noise does a crab make?","කකුළුවෙකුගේ ශබ්දය කුමක්ද?"
"penguin","Penguin","පෙන්ගුයින්"
"penguin_2","I like penguins.","මම පෙන්ගුවින් වලට කැමතියි."
"penguin_3","I saw a penguin.","මම පෙන්ගුවින් එකක් දැක්කා."
"penguin_4","What noise does a penguin make?","පෙන්ගුවින් ශබ්දය ඇති කරන්නේ කුමන ශබ්දයද?"
"elephant","Elephant","අලියා"
"elephant_2","I like elephants.","මම අලි වලට කැමතියි."
"elephant_3","I saw an elephant.","මම අලියෙක් දැක්කා."
"elephant_4","What noise does an elephant make?","අලියෙකුගේ ශබ්දය කුමක්ද?"
"zebra","Zebra","සීබ්රා"
"zebra_2","I like zebras.","මම සීබ්‍රා වලට කැමතියි."
"zebra_3","I saw a zebra.","මම සීබ්‍රාවක් දැක්කා."
"zebra_4","What noise does a zebra make?","සීබ්‍රා ශබ්දයක් නිකුත් කරන්නේ කෙසේද?"
"panda","Panda","පැන්ඩා"
"panda_2","I like pandas.","මම පැන්ඩා වලට කැමතියි."
"panda_3","I saw a panda.","මම පැන්ඩා දැක්කා."
"panda_4","What noise does a panda make?","පැන්ඩා කරන ශබ්දය කුමක්ද?"
"monkey","Monkey","වඳුරා"
"monkey_2","I like monkeys.","මම වඳුරන්ට කැමතියි."
"monkey_3","I saw a monkey.","මම වඳුරෙක් දැක්කා."
"monkey_4","What noise does a monkey make?","වඳුරෙකුගේ ශබ්දය කුමක්ද?"
"camel","Camel","ඔටුවා"
"camel_2","I like camels.","මම ඔටුවන්ට කැමතියි."
"camel_3","I saw a camel.","මම ඔටුවෙකුව දුටුවෙමි."
"camel_4","What noise does a camel make?","ඔටුවෙකුගේ ශබ්දය කුමක්ද?"
"mouse","Mouse","මූසිකය"
"mouse_2","I like mice.","මම මීයන්ට කැමතියි."
"mouse_3","I saw a mouse.","මම මූසිකයක් දුටුවෙමි."
"mouse_4","What noise does a mouse make?","මූසිකය නිපදවන ශබ්දය කුමක්ද?"
"tiger","Tiger","කොටියා"
"tiger_2","I like tigers.","මම කොටින්ට කැමතියි."
"tiger_3","I saw a tiger.","මම කොටියෙක් දැක්කා."
"tiger_4","What noise does a tiger make?","කොටියෙකු ඇති කරන ශබ්දය කුමක්ද?"
"jellyfish","Jellyfish","ජෙලිෆිෂ්"
"jellyfish_2","I like jellyfishes.","මම ජෙලිෆිෂ් වලට කැමතියි."
"jellyfish_3","I saw a jellyfish.","මම ජෙලිෆිෂ් එකක් දැක්කා."
"jellyfish_4","What noise does a jellyfish make?","ජෙලිෆිෂ් කරන්නේ කුමන ශබ්දයද?"
"crocodile","Crocodile","කිඹුලා"
"crocodile_2","I like crocodiles.","මම කිඹුලන්ට කැමතියි."
"crocodile_3","I saw a crocodile.","මම කිඹුලෙක් දැක්කා."
"crocodile_4","What noise does a crocodile make?","කිඹුලෙකුගේ ශබ්දය කුමක්ද?"
"koala","Koala","කෝලා"
"koala_2","I like koalas.","මම කෝලාස් වලට කැමතියි."
"koala_3","I saw a koala.","මම කෝලා එකක් දැක්කා."
"koala_4","What noise does a koala make?","කෝලා වල ශබ්දය කුමක්ද?"
"ostrich","Ostrich","පැස්බරා"
"ostrich_2","I like ostriches.","මම පැස්බරා වලට කැමතියි."
"ostrich_3","I saw an ostrich.","මම පැස්බරා දැක්කා."
"ostrich_4","What noise does an ostrich make?","පැස්බරාගේ ශබ්දය කුමක්ද?"
"racoon","Racoon","රකූන්"
"racoon_2","I like racoons.","මම රකූන් වලට කැමතියි."
"racoon_3","I saw a racoon.","මම දුටුවා."
"racoon_4","What noise does a racoon make?","රකූන් කරන ශබ්දය කුමක්ද?"
"bat","Bat","වවුලා"
"bat_2","I like bats.","මම වවුලන්ට කැමතියි."
"bat_3","I saw a bat.","මම පිත්තක් දැක්කා."
"bat_4","What noise does a bat make?","වවුලෙකුගේ ශබ්දය කුමක්ද?"
"eagle","Eagle","රාජාලියා"
"eagle_2","I like eagles.","මම රාජාලීන්ට කැමතියි."
"eagle_3","I saw an eagle.","මම රාජාලියෙකු දුටුවෙමි."
"eagle_4","What noise does an eagle make?","රාජාලියෙකු කරන ශබ්දය කුමක්ද?"
"hippopotamus","Hippopotamus","හිපපොටේමස්"
"hippopotamus_2","I like hippopotamus.","මම හිපපොටේමස් වලට කැමතියි."
"hippopotamus_3","I saw a hippopotamus.","මම හිපපොටේමස් දැක්කා."
"hippopotamus_4","What noise does a hippopotamus make?","හිපපොටේමස් නිපදවන ශබ්දය කුමක්ද?"
"seal","Seal","මුද්‍රාව"
"seal_2","I like seals.","මම සීල් වලට කැමතියි."
"seal_3","I saw a seal.","මම මුද්‍රාවක් දුටුවෙමි."
"seal_4","What noise does a seal make?","මුද්‍රාවක් මගින් ඇති කරන ශබ්දය කුමක්ද?"
"walrus","Walrus","වොල්රස්"
"walrus_2","I like walruses.","මම වල්රස් වලට කැමතියි."
"walrus_3","I saw a walrus.","මම දැක්කා walrus."
"walrus_4","What noise does a walrus make?","වොල්රස් කරන්නේ කුමන ශබ්දයද?"
"seahorse","Seahorse","මුහුදු අශ්වයා"
"seahorse_2","I like seahorses.","මම මුහුදු අශ්වයන්ට කැමතියි."
"seahorse_3","I saw a seahorse.","මම මුහුදු අශ්වයෙක් දැක්කා."
"seahorse_4","What noise does a seahorse make?","මුහුදු අශ්වයෙක් කරන්නේ කුමන ශබ්දයද?"
"bull","Bull","ගොනා"
"bull_2","I like bulls.","මම ගොනුන්ට කැමතියි."
"bull_3","I saw a bull.","මම ගොනෙක් දැක්කා."
"bull_4","What noise does a bull make?","ගොනෙක් කරන ශබ්දය කුමක්ද?"
"pelican","Pelican","පෙලිකන්"
"pelican_2","I like pelicans.","මම පෙලිකන් වලට කැමතියි."
"pelican_3","I saw a pelican.","මම පෙලිකන් දුටුවෙමි."
"pelican_4","What noise does a pelican make?","පෙලිකන් කරන ශබ්දය කුමක්ද?"
"beaver","Beaver","බීවර්"
"beaver_2","I like beavers.","මම බීවර් වලට කැමතියි."
"beaver_3","I saw a beaver.","මම දුටුවා."
"beaver_4","What noise does a beaver make?","බීවර් කරන්නේ කුමන ශබ්දයද?"
"goldfish","Goldfish","ගෝල්ඩ්ෆිෂ්"
"goldfish_2","I like goldfishes.","මම රන් මාළු වලට කැමතියි."
"goldfish_3","I saw a goldfish.","මම දැක්කා රන් මාළුවෙක්."
"goldfish_4","What noise does a goldfish make?","ගෝල්ඩ්ෆිෂ් කරන ශබ්දය කුමක්ද?"
"goldfish_5","Can we get a goldfish as pet?","සුරතල් සතුන් ලෙස අපට රන් මාළුවෙකු ලබා ගත හැකිද?"
"rhinoceros","Rhinoceros","රයිනෝසරස්"
"rhinoceros_2","I like rhinoceros.","මම රයිනෝසරස් වලට කැමතියි."
"rhinoceros_3","I saw a rhinoceros.","මම රයිනෝසරයක් දැක්කා."
"rhinoceros_4","What noise does a rhinoceros make?","රයිනෝසරයක් ඇති කරන ශබ්දය කුමක්ද?"
"snake","Snake","සර්පයා"
"snake_2","I like snakes.","මම සර්පයන්ට කැමතියි."
"snake_3","I saw a snake.","මම සර්පයෙක් දැක්කා."
"snake_4","What noise does a snake make?","සර්පයෙකු කරන ශබ්දය කුමක්ද?"
"lion","Lion","සිංහයා"
